"id"	"researcher_name"	"application_title"	"application_summary"
"566047"	"Fang, Qiyin"	"Miniaturized optical sensing/imaging technology development for environmental and biomedical applications"	"Optical spectroscopy and imaging allow remote, minimally-invasive monitoring of activities; provide morphological information that describes structure/shape; and may be used as a functional diagnostic tool for measuring of biochemical and physiological characteristics. Recent advances of photonics technology are the driving force behind many novel optical devices development. Various optical spectroscopy and imaging technologies have been investigated for applications in life sciences research (e.g. microscopic imaging), environmental sensing (e.g. water quality monitoring) and medical diagnosis (e.g. endoscopic imaging). In practice, there are strong demands for miniaturized, integrated devices for in-situ applications. For example, in screening of cancers in the gastrointestinal (GI) tract, it is highly desired to have encapsulated, functional optical imaging modalities (fluorescence, Raman, etc.) for minimally-invasive detection of malignant lesions. Another example is implantable microfluidic and optical imaging based cellular analysis devices for continuously monitoring of the biochemical and physiological conditions of the patients as well as the environment. Conventional optical spectroscopy and imaging systems are large, complex and costly optoelectronic instruments comprised of lasers, spectrophotometers, and detectors. Often, their size is the limiting factor for their use in certain applications such as in-situ monitoring of physiological processes and distributed environmental sensing. Recent advances in micro-photonics and electronic devices have led to small but efficient components/modules such as diode lasers, single photon avalanche diodes detectors, microlenslets, and GRIN optics. When integrated with microfluidics technology, fully integrated devices can be made by Micro-electro-mechanical-systems (MEMS) or Micro-optical-electro-mechanical-systems (MOEMS). These technologies are mostly built upon well-established microelectronic technologies for integrated circuitry. When conventional devices are replaced with micro-components, new applications and capabilities can be facilitated. Moreover, it usually leads to significant cost reductions and increases in yield associated with mass production. Although progresses have been made recently in the development of individual components such as micro-cantilevers, micro gratings, and micro-lens, etc, integration of these components into complete micro-spectroscopic and imaging devices remains as a very challenging problem. For a complete optical spectroscopic/imaging system, more complex components such as miniature light sources, photo detectors, and high-speed electronics are also required. Furthermore, medical and environmental application of these technologies raises new requirements such as toxicity, chemical/biological stability, and sterilization concerns. The overall objectives of the proposed research program are to (i) develop integrated micro- optical spectroscopic technologies for spectrally- and temporally-resolved optical signal acquisition; (ii) investigate the integration of high speed photo detection modules into the micro-spectrometer; and (iii) development of a fully integrated encapsulated endoscope. The proposed program will be based on the Micro/Nano Systems Lab and focus on integrated device technology development. Its success will allow translation of such technology to applications in biomedical diagnosis, drug discovery, and environmental monitoring.""564854,""Fang, Qiyin"
"567983"	"Farag, Hany"	"Advanced Design, Planning and Control Algorithms for Smart Distribution Grids"	"Driven by the urgent need to develop cleaner and more efficient, reliable, and resilient electric power grids, the energy sector is currently moving towards an era of smart grids. The main pillar of a smart grid setup is the evolution from a vertically integrated, partially-automated and producer-controlled electric power network to a decentralized one that enables interactions among customers, network operators, and power producers. In response to smart grid initiatives, electrical distribution grids are undergoing a major transition towards a smart distribution grids (SDGs) structure characterized by high penetration of distributed and renewable generation (DG), plug-in electric vehicles (PEV), energy storage devices, and grid-automation devices. The structure of SDGs will be divided into set of microgrids with sufficient generation to meet all or most of their local loads.  Yet, major technical challenges face the realization of SDG vision due to its emergent nature. To that end, the proposed research program aims to develop a unifying framework for design, planning and control strategies of SDGs to facilitate timely and safe transition of distribution grids. In particular, three main projects will be conducted in the proposed research program. First, developing new design and planning strategies for the structure of SDGs (e.g. Optimal allocation and sizing of new components and technologies in SDGs, optimal set of microgrids that can be identified, created, and designed in a typical SDG and optimal configuration of the created microgrids). Second, developing a comprehensive multi-agent distributed control scheme to facilitate a scalable real-time cooperative control in SDGs. The proposed control scheme will integrate several operational scenarios and control objectives for SDGs clustered into microgrids with different configurations and modes of operation; important among these are online self-healing, power quality, and voltage stability. Third, developing real-time smart coordinated control schemes to accommodate high penetration of PEVs into aging distribution grids.  The proposed research will help distribution power utilities to eliminate the current barriers towards the deployment of sustainable and clean energy resources, and smart grid technologies into the utility grid. The proliferation of these new essentials will help improve the overall power system performance by increasing the system reliability, power quality and efficiency while minimizing the environmental impact of the current central power generation plants. The proposed research is expected to create a knowledge-base and tools that are extremely useful to the energy system industry to facilitate the safe transition of current distribution grids into SDGs through better understanding of new requirements, upgrades, and concepts. The proposed research will place the theoretical foundations in the emerging area of SDGs research. Further, it will provide students with skills in vital areas of smart grids and sustainable energy. The energy and environment have been identified as a driving force for the new energy economy; Canada is a world leader in this area thus the accomplishment of the proposed research plan will have significant and measurable economic and environmental impact to Canada.""553622,""Farah, Amjad"
"566529"	"Farzan, Azadeh"	"Advances in Program Analysis"	"The proposed research is in the area of Program Analysis, which is the process of automatically analyzing the behaviour of computer programs. A well-stablished application of program analysis has been in the domain of Software Verification which aims at ensuring the reliability of software, using automated techniques and tools. With the emerging omnipresence of software in all aspects of our lives, ensuring reliability of software has become essential. With multicore processors becoming the default choice for computers and mobile devices and the advent of distributed web services, concurrency has become commonplace in application software. The design of concurrent programs is notoriously error-prone due to the nondeterministic interactions among concurrently executing program threads. The proposed research will advance the state of the art in concurrent software analysis. More specifically, we will focus on achieving this in the presence of some the most widely used programming language features that, combined with concurrency, make the task of program analysis difficult and consequently there is a shortage of effective program analysis techniques. We have made significant progress in the past few years by introducing a novel way of approaching this problem domain, based on the notion of dataflow, and plan to unleash their power for addressing some of the most challenging problems in concurrency research, including: Unbounded Concurrency: program analysis becomes substantially more complicated when there is no a priori bound on the number of interacting processes that constitute a program. This is usually referred to as unbounded concurrency. Many broadly used software systems, for example device drivers, file systems, and concurrent libraries naturally adhere to this model, which makes their verification problem very relevant. Dynamic Memory (heap): All modern programming languages have primitives for creating and manipulating memory dynamically, and it is virtually impossible nowadays to find software that does not use dynamic memory. Reasoning about programs manipulating the heap, which is unbounded, is a theoretically and practically hard problem, even without the presence of concurrency, and particularly more challenging with it. The challenge is usually in producing a precise enough understanding of the heap that will not hinder the task of program analysis. Relaxed Memory Consistency: Concurrent programs have different behaviours under different memory models guaranteeing different levels of memory consistency. In the sequential consistency memory model, there is a single, global view of time in an execution. In relaxed memory models, each processor has its own view of time, and the views may not be consistent. Since no actual computer implements sequential consistency memory model, analyzing programs under a relaxed memory model (a challenging task) is the only possible way of getting practically relevant results. Numerical Uncertainty : Scientific applications, like high-throughput medical imaging or high-performance simulations of climate models, demand great computational resources. These scientific applications are typically run on multicore and multi-processor environments. The problem is that the same concurrent program can produce different results when used with different architectures and compilers, a sensitivity that is especially critical for floating-point computations. These are due to some well-known and some lesser- known dependencies of floating-point behaviour on execution order (which is determined by the concurrent execution model). This puts the portability and reliability of computation results across platforms under question, which makes this under-explored problem area worthy of attention.""557146,""Farzaneh, Masoud"
"567923"	"Fong, Philip"	"Security and Privacy Protection for Social Computing"	"We increasingly store personal information on various digital platforms. Of particular concern are the emergence of social computing platforms (e.g., Facebook, Foursquare) as custodians of information about our private and social life, as well as the shifting culture of the next generation to willingly disclose the minute details of their personal lives via such platforms. These platforms present unique security and privacy challenges that are not addressed by classical protection technologies. The study of Access Control involves the articulation and analysis of protection models for regulating access to information, and the design of mechanisms and technologies for realizing these models. In this proposed research program, I will explore access control innovations that are motivated by the novel security and privacy challenges of social computing. This proposed research program has three objectives. First, it aims at devising innovative protection technologies for addressing the unique security and privacy challenges in social computing platforms. Examples include technologies for the prevention of inference attacks by Facebook applications, protection technologies for controlling access to resources that affect the privacy of multiple parties (e.g., photo tagging), and assessment of privacy risks in geo-social network systems (e.g., Foursquare). Second, this research program aims at formulating mathematical models for improving our understanding of emerging social computing paradigms. Examples include building mathematical theories for modelling social contracts in online communities (e.g., Wikipedia), as well as formulation of mathematical models for the authorization mechanisms of geo-social network systems. A third objective of this research program is to devise supporting technologies that would make it easier for users to interact with advanced access control models for social computing. An example is to design visual formalisms so that users may draw diagrams to specify social contracts for an online community.""554468,""Fontaine, Arnaud"
"567652"	"François, Véronique"	"Space Division Multiplexing"	"The research objective of this proposal is to build a world-class program on space-division multiplexing (SDM) using multicore optical fibers, in order to shape next-generation, terabit-per-second capacity (10e12 bits/s) ultra-dense optical interconnects. We will design, make and test multicore optical fibers and coupling devices compatible with the established technology of two dimensional arrays of high-speed vertical-cavity surface-emission lasers (VCSELs) for the development of active optical cables with dramatically expanded capacity. In recent decades, we have witnessed an incredible revolution in communications and computing based on the advancement of optical fibers, photonic devices and electronic circuits. While single-mode fibers and wavelength division multiplexing (WDM) historically offered plenty of transmission capacity for long-haul and metro networks, the new applications for optical networks, such as machine interconnectivity and local area networks, require both large capacity per fiber core and increased core spatial density. The electronics industry is presently experiencing communications bottlenecks in integrated circuits, and this is particularly evident in inter-chip communications (e.g., between microprocessor and memory, and between multiple microprocessors). Short-reach optical interconnects, which typically span up to a few hundred meters, overcome the bottleneck of electrical interconnects caused by heat dissipation and size congestion: high-performance super computers manufactured in 2013 use more than 10e5 lasers typically; the IBM Blue Water super-computer uses over 1 million optical channels! In computing systems, space is a major concern. However, the benefits of very short reach optical interconnects (less than 1 meter long) still have to be established for inter-chip data communications and core-to-core on-chip communications. Can more space-efficient optical links be engineered, versus using the conventional single-core optical fiber? Recent developments in fiber-optic fabrication techniques have triggered interest in multicore optical fibers to increase spatial density by building several guiding cores in a single fiber of the same diameter. Record transmission capacity of 1.01 petabit-per-second (10e15 bits/s) was demonstrated in 2012 by Japanese researchers at NTT using such a 12-core fiber. The research program will transpose this achievement to optical interconnects by developing customized multicore fiber, active and passive coupling devices, circuits, and architectures to replace the less space-efficient fiber ribbons currently used in the industry. The new optical interconnects will be able to carry independent channels in several tens of guiding cores, thus permitting near terabit/s capacity over a single fiber using 25-Gb/s VCSELs. Our group is already equipped with the necessary design tools, has contributed to the concept of SDM for optical interconnects, has set key Canadian and international collaborations for multicore fiber sourcing, and benefits from world-class laboratory facilities. The proposed research program will contribute to the development of synergies between electronic and photonic integration technologies, which will result in revolutionary changes in photonics manufacturing that will dramatically change design principles and fundamentally improve performance. Canada is a world leader in Information and Communications Technologies (ICT). The proposed research directly supports Canada's strategic priorities in ICT Device and Systems (as stated in NSERC selected Target Areas and Research Topics), by the development of technologies that will dramatically increase the spatial density of optical links.""546950,""François, Vincent"
"566337"	"Frappier, Marc"	"A formal approach to access control and consent management"	"Personal data are widely distributed in enterprise information systems (IS) and shared across thousands of users. Protecting the confidentiality and integrity of personal data is critical in several domains like health, banking and governmental programs. Access control is responsible for controlling who has access to what and when in an IS. The objective of this research proposal is to develop a formal framework for controlling access to personal data stored in information systems. This framework shall ensure that personal data is accessed according to the requirements of the organisation and the requirements of the individuals related to the personal data. This framework shall address the following issues. First, it must include a proper mechanism for modeling IS users, individuals and their personal data, and access control rules, which together form an access control policy. Second, it must include a mechanism for specifying and verifying properties of an access control policy, to ensure that both individual requirements and organisational requirements are taken into account. Third, it must include an access control engine that can apply an access control policy to an access request. Finally, this framework should be general enough to be used in a variety of application domains; in others words, we need to transition from an ad hoc way of developing access control systems to a systematic approach based on a sound and powerful model of what access control consist of.""547669,""Fraser, Ailana"
"567493"	"Frasson, Claude"	"Brain-Based Intelligent Tutoring Systems"	"Our objectives are inspired by some results we have obtained from previous experiments on subconscious learning . In these works we have discovered that brainwaves analysis allowed to distinguish a change, at a moment, between cognitive reasoning and intuitive reasoning, in other words from conscious to subconscious mode. This change is similar to what is observed when learners switch from a cognitive task to gaming. Instead of continuing to find a solution, they play with the system until they encounter a solution but just by trial and error without any cognitive effort. This leads to an important problem in knowledge acquisition which corresponds to a cerebral state: engagement or disengagement. In the first one, the learner is interested (motivated) to explore the possible solutions and could converge to the final solution. In the second one, the learner is no more interested to continue on the task (which sometimes explains the derivation to gaming). Our experiments highlighted also two typical kinds of reasoning: cognitive reasoning and intuitive reasoning. While the first involves generally the conscious part of the brain, the second is more linked to the subconscious part. Sometimes, a problem solving situation will involve successively cognitive and intuitive reasoning, switching back and forth between the two modes. In both cases emotions play an important role to facilitate or not learning. The emotional conditions of the brain allow for the transmission of information not only to the conscious part but also to subconscious region and this last one seems to contain more knowledge and to process the information at a higher speed. As we have seen in our previous studies, the affective part is extremely important as it prepares the brain to accept or not the information. Intuitive behaviour is more present in video games. For instance, in flight training or games the resulting experience and abilities will concern immediate reactions (reflexes) Following our previous works, we want to detect more precisely emotional conditions and cerebral states that lead to engagement or disengagement. This implies to detect the emotional condition (for instance a learner is excited or not) and learning condition (the learning objectives are too high) in which learning occurs, and measure the resulting cerebral state (for understanding more clearly the different steps of learning and the evolution of cerebral states). Moreover, a continuous control of learner’s brain activity could be used by an intelligent system to give advices to the learner and put him into the best emotional conditions for learning. As we can see the brain is at the center of this intelligent system. An intelligent personal adviser (agent) could follow the evolution of cerebral states and provide personalized advices to optimize learning. To reach this goal, we need to explore more possibilities to detect the different steps of engagement and disengagement (when a learner cannot understand the problem and find the solution) through EEG signals. The main problem remains to detect and monitor the learner emotional state with precision and in real time. Emerging device allow to have a direct interaction between the learner and his environment (eye tracking systems, brainwaves interaction with helmets) The general objectives of our research are (1) to build an integrated interactive Brain-based environment able to detect the conditions of engagement and disengagement both in cognitive and intuitive learning,using a video game, and (2) to build a complete Brain-based video game learning environment able to provide the best pedagogical strategies to foster learner’s memorization and knowledge acquisition.""554232,""Fravalo, Philippe"
"567027"	"Freundorfer, Alois"	"3D Ceramic Sensors and Circuits"	"Advances in technology have greatly influenced all aspects of society in the last twenty-five years. As a result, information technology, medical equipment and consumer products such as cellphones, computers, video recorders, automotive parts, etc. rely heavily on microsystems technology (i.e. microelectronics, photonics, wireless circuits and sensors). Future products will desire systems that are more compact, versatile, functional and less expensive. To achieve this, higher operating frequencies and wider bandwidths become necessary. This research will focus on high speed electronics to create a higher level of integration and functionality using advanced low temperature ceramics.  We have developed a unique low temperature ceramic process for depositing thin film, thick film and 3-D ceramics onto integrated circuits (ICs) and printed circuit boards (PCBs). Most ceramics have to be made at around 1000 degrees Celsius or more. This destroys the IC. We can do it at 150 degrees Celsius and maintain the integrity of the IC. No one else has achieved this. This will impact tunable electronics, miniature electronic antennae and filters with the development of appropriate masking methods. We were the first to integrate 3-D ceramics onto ICs and PCBs, reducing product size and cost, and increasing functionality. We will investigate magnetic ceramic materials in our novel low temperature process. This will allow applications to electronics beyond the standard norm because these materials could then be deposited onto ICs and PCBs.  The proposed research will assist the Canadian industry in producing and manufacturing smaller, more versatile and less expensive products. This will provide a substantial competitive advantage globally in medical sensors, automotive radar, millimeter wireless LAN like the future 5G phone and medical diagnostics equipment.""564668,""Frey, Alex"
