"id"	"researcher_name"	"application_title"	"application_summary"
"402973"	"Sabati, Mohammad"	"The use of fuzzy logic in magnetic resonance imaging"	"Magnetic resonance (MR) is a powerful imaging modality in which spatially encoded raw data is acquired from the object being imaged. A computer program then processes these data to obtain the desired tomographical, or cross-sectional, image. In the past two decades, numerous data acquisition methods and image reconstruction techniques have been introduced to ""efficiently"" collect the necessary raw data and to generate diagnostic and informative medical and non-medical images. A variety of methods were required to target different MR applications (like imaging of stationary or moving objects, vascular imaging, measuring flow, and imaging specific tissues) and to overcome MR limitations (like lengthy acquisitions, artifacts from subject motion, and blurring).     In MR imaging, the relationship between the imaged object, the data acquisition, and the information content of the reconstructed image is a complex process where exact knowledge about this relationship has been only established using numerical and limited non-numerical information. This complexity arises because of unknown object's content, unpredictable motion artifacts during imaging, and unpredictable dynamics such as perturbations, external noise and disturbance. Hence, the information gathered before or during the imaging process is never complete, sharp or comprehensive.    In this research, we will investigate the use and suitability of relatively new informational logic, known as fuzzy logic, to incorporate linguistic expert knowledge into novel data acquisition and reconstruction algorithms for MR. We anticipate that fuzzy logic can address some MR current limitations and can provide accurate information in a shorter time. Our proposed study is directed towards experimental and computational techniques that can be used to prevent and/or minimize artifacts during imaging; rather than looking at post-imaging solutions.""394590,""Sabbagh, Mark"
"402861"	"Sadat, Fatiha"	"Towards a hybrid approach to cross-language information retrieval"	"Cross-language information retrieval (CLIR) allows a user to formulate a query in one language and to retrieve documents in one or more languages. The current research proposal concerns a unified approach of query translation and document translation with an application on morphologically complex languages such as Arabic, Chinese, French and English. The query translation approach translates queries into document languages using available linguistic resources; while the document translation approach translates the retrieved documents into the target language. This research proposal is based on four major parts and objectives, as follows:1. Investigate on query translation using the dictionary-based approach. An investigation on the disambiguation of polysemous lexical items using word co-occurrence graphs will be pursued. Furthermore, efficient algorithms for the transliteration of cognates and named-entities using a hybrid spelling and phonetic information will be developed. 2. Design and implement efficient methods for translating large sets of retrieved documents. Three methods based on rules, statistics and their combination, respectively, will be explored. Special data such as named entities, dates, numbers and currencies will be investigated carefully with both rule-based and statistical approaches. Furthermore, linguistics information, such as syntax and morphology are needed in the pre-processing step. Arabic and Chinese languages suffer from the problem of word segmentation. 3. Continue the research on exploiting comparable corpora for bilingual dictionary enrichment and machine translation. One of the major bottlenecks in the development of portable and robust NLP applications with broad coverage is the lack of linguistic resources.  4. Develop efficient and comparative algorithms for query expansion using an ontology-based approach and relevance feedback in both pre- and post-translation phases.""404942,""Sadavoy, Sarah"
"402846"	"SafaviNaieni, Rei"	"Authentication and identification for next generation communication systems"	"Authentication of information is arguably the most important security goal in modern electronic communication systems. Receiving a message on a computer terminal needs assurance that the message is coming from the claimed sender and it has not been tampered with. This assurance does not exist for most communications over the Internet today.  Inadequate security for identification of users, devices and services, and authentication of messages has made attacks such as identity theft and fake websites, a major security concern. Authentication systems provide assurance for communicants about entities involved in the communication and the messages that are exchanged. Authentication systems must also meet the challenges resulting from the advancement of technologies and the introduction of new services. Applications such as social networking and instant tele-conferencing require secure authentication in dynamic groups.  Multimedia data is produced at very large volumes and multimedia authentication systems have special requirements such as tolerance to small changes in data.   A growing concern in authentication systems is users' privacy and the assurance that users' data cannot be later used to breach their privacy.A useful authentication system must be provably secure and also sufficiently efficient to be acceptable by the users.   The two most important approaches to proving security are information theoretic security that provides an unlimited and everlasting security guarantee, and computational security that guarantees security for the   lifetime of the data. The main advantage of this latter approach is the efficiency gain. In this  research program we will,  (i) explore,  model and analyze  the problem of entity and message authentication in today and future communication systems, and  (ii)  construct  efficient authentication systems with provable security that satisfy extra properties such as privacy of the users, or tolerance to small changes in multimedia data that are byproducts of commonly used multimedia processing. The proposed program will produce highly qualified graduate students equipped with knowledge of theoretical and practical information security.""407438,""SafaviNaini, Arghavan"
"396450"	"Salavatipour, MohammadReza"	"Approximation algorithms, approximablity, and algorithmic graph theory"	"My current and planned research focuses on the following sub-areas in theoretical computer science:i) design of efficient approximation algorithms for problems that naturally arise in applications such as network design and computational economy, (ii) study of computational complexity and hardness of approximation for such problem, and (iii) algorithmic aspects of graph theory and graph coloring problems on planar graphs.Most of the real world optimization problems, such as the ones on graphs that arise from applications in the design of networks, are NP-hard. Therefore, under widely believed assumptions, we cannot solve these problems in a reasonable amount of time. Given this, it is typically acceptable to compute a near optimal solution efficiently. So research has focused on the study of approximation algorithms; these are algorithms that run fast and produce a solution that is within a guaranteed factor of the optimal one. Among these optimization problems, those related to graphs and network design are particularly important and have attracted more attention recently. Another class of such problems arise in computational economy (for example how to price bundles of items to maximize revenue and or customer satisfaction). It is also  important to study the hardness of approximation (computational complexity) of these problems. This helps to put the quality of the proposed algorithms in perspective, and have a better understanding of the level of difficulty of these  problems which in turn could be used to design better algorithms.A significant amount of my research will involve the study of coloring and other problems on graphs and in particular on planar graphs. Some of these problems (which have theoretical importance) have also applications in frequency channel assignments in a cellular network. The question of minimizing the number of colors in a specific coloring problem translates to minimizing the frequency bandwidth required in such a network.""413505,""Salcudean, Septimiu"
"403688"	"Samaan, Nancy"	"A testbed for wireless mesh networks"	"Wireless mesh networks (WMNs) represent the next wave in wireless technologies due to their ease of deployment and economy. Nonetheless, being a nascent technology, WMNs still lack many of the development tools, available to older wired/wireless technologies, and needed to exploit their full potential. An essential tool to pursue research in this area is a software simulator or an experimental testbed. However, a reliable simulator for WMNs does not exist due to a lack in understanding the characteristics peculiar to these networks (e.g., dynamic capacity, interference and fairness). This fact makes an experimental testbed the only possible avenue for developing and evaluating new research ideas before they can be applied to commercial products.    )This application seeks to acquire an experimental WMN testbed and utilize it for a two objectives. The first objective has a long-term nature and aims at constructing a fully autonomic carrier-grade WMN. The second short-term objective is focused on establishing adaptive quality-of-service (QoS) provisioning solutions for WMN networks. The short-term activities in the proposed research involve two main phases.  The first phase will be directed towards characterizing WMN performance. The requested testbed will be applied to address many questions needed to proceed with this characterization such as: what is the capacity of a given WMNs? What are the effects of varying cross-layer parameters such as transmission power, modulation rate, and the use of multi-channels on capacity? How does fairness affect flows throughput? Measurements collected during this phase will represent a significant research output in its own right, allowing researchers to reproduce testbed properties in simulation. An important outcome of this phase also is the development of a new metric for QoS unique to WMNs. The second phase will evaluate various developed QoS schemes for topology selection, admission control, traffic scheduling, and network self-configurability.  Finally, long-term research activities will address advanced WMN problems such as mobility and handoff and will investigate emerging scalability issues by extending the size of the testbed.""403669,""Samaan, Nancy"
"389857"	"Sankoff, David"	"Mathematical genomics"	"We study the mathematics, statistics and computing of genome rearrangements, the evolutionary processes by which segments of chromosomes are inverted, moved around and exchanged.  There is an algorithmic technology for inferring a minimizing sequence of operations necessary to transform one genome into another, where the operations are modeled on processes such as inversion, reciprocal translocation, chromosome fusion and fission, transposition of chromosomal segments. Once these inferences are made, however, there is a need for some way to statistically validate both the inferences and the assumptions of the evolutionary model.     Our approach is to use models of random genomes to see to what extent there is an signal remaining in the comparative structure of the two genomes, or whether evolution has largely scrambled the order of each one with respect to the other.     We work on the problem of the rearrangement median for three genomes as the basis for gene order phylogeny based on rearrangements, and apply it to chloroplast and mammalian data sets.      We study the ""genome halving problem"" for ancient tetraploids and extensions to mixed ploidy gene order phylogenies. We apply this to the study of the ""Saccharomyces complex"" of yeast species.    In comparing genomic maps, we introduce the notion of partially ordered genomes to take into account missing and unresolved data, and use this to compare the genomes of various cereal species.  We also work on distinguishing mapping errors from genuine rearrangements of the genomes and we apply this to the comparison of the rice and sorghum genomes.     We have defined a new measure of ""generalized adjacency"" as a useful tool in computing ancestral genomes within a phylogeny.  This leads to many algorithmic and statistical questions we propose to investigate.""412897,""Sankoff, David"
"395454"	"Sarkar, Anoop"	"Semi-supervised learning for natural language processing"	"Natural language is the main repository of human knowledge, and with the advent of large amounts of readily available machine-readable natural language text such as the web and newswire feeds, there has been a steady increase in the number of computational applications that attempt to extract information from these sources. The field of natural language processing now has a well-developed suite of approaches that use supervised machine learning. However, adapting to a new domain or a new language, especially a language with insufficient data, is still a major bottleneck when building software applications that process natural language. This proposal aims to address this crucial issue by exploring the use of semi-supervised machine learning methods for natural language, which can learn even when only a small amount of training data is available.Here are two examples of benefits from this research: First, by using domain-general information about English and then adapting to a specialized language, such as bio-medical research papers, natural language applications can be used to extract information in this new domain. Second, machine translation systems are trained on sentences previously translated by human translators, but such translations are only available in large quantities in a domain like parliament proceedings, e.g. the French-English Canadian Hansards. But this domain is not well suited to build a machine translation system for another domain, e.g. political weblogs. Our research enables translation systems to adapt to this new domain. Our research also enables machine translation in a domain where only small amounts of training data are available, e.g. the Nunavut Hansards.""400318,""Sarkar, Niladri"
"389680"	"Schaeffer, Jonathan"	"General game-playing programs"	"For over 25 years, I have been working on applying heuristic search and knowledge techniques towards building high-performance artificial intelligence (AI) systems. I often use game-playing and puzzle-solving programs as my experimental test domains. This has led to success in numerous domains (chess, checkers, poker, sliding tile puzzles, Rubik's Cube - all yielding valuable insights). However, each program is ""one of a kind"", with limited carryover from domain to domain. Although some of the algorithms apply to classes of applications, each high-performance AI system represents a complete re-implementation.   Humans are very good at transferring their experience in one domain (a game/puzzle in this case) to another. The state of the art in computing science is that the program designer transfers their experience from building a program for one domain to that of building a program for another domain. Ideally, the human should be factored out of this process.   There has been movement in the AI community to build general systems that can handle a broad class of applications. In this particular case, can we build a program capable of taking any game and, based solely on the rules and past experience, build a new game-playing program? Such a program would be a step towards the realization of ""human level"" AI.    This project will investigate the research issues around building a high-performance (high level of demonstrated skill) general game-playing program. The intent is to have a program that is a) capable of learning to play a broad spectrum of games and b) is scalable in its ability to learn (more learning time equates to better performance).""412878,""Schaeffer, Jonathan"
"402853"	"Schroeder, Bianca"	"Understanding and coping with failure at scale"	"The funds requested in this proposal will serve to provide the resources required to carry out the PI's new research program on ""Understanding and coping with failure at scale"". The goal of this new research program is to address the age-old problem of building highly reliable computer systems in a novel way. The key observation is that, although system reliability has been a key concern since the first computer systems were build 50 years ago, embarrassingly little is known about basic characteristics of failures in real systems, since virtually no data on failures in production systems is publicly available. As a result, much research is based on hypothetical and often simplistic assumptions.The broad goal of the PI's new research program is to enable the creation of more reliable systems through a detailed understanding of real-world failures. The motivation for this research program comes from the PI's initial results on failure data analysis, which show that many common assumptions about failures are not realistic and that making those assumptions can lead to highly sub-optimal solutions. These results indicate a strong need for a better understanding of failures in the real world and more realistic failure models, based on empirical data. The PI plans to analyze large amounts of failure data from real production systems in order to derive insights into the root cause of failures, statistical properties of failures and more realistic failure models, and then use this knowledge to develop better methods for avoiding, coping with and recovering from failures.""404490,""Schroeder, Cheryl"
"393220"	"Schulte, Oliver"	"Machine learning for entity-relationship databases"	"My research develops new mathematical concepts to extend statistical principles so that they can be applied to large and complex modern databases. The computational challenge is to develop efficient programs that can apply these algorithms to rapidly sift and identify useful information-essentially revealing diamonds in the rough. Vast amounts of data are gathered daily for different purposes. As more and more organizations and companies accumulate data, a crucial competitive edge comes with the ability to efficiently find informative patterns in the data and to learn from it to improve decision-making. This process requires computational tools for extracting information from data records. The proposed research combines fundamental time-tested statistical concepts with new machine learning technology to provide practical data analysis tools that have a strong theoretical foundation. The most successful learning programs are based on statistical concepts. The problem is that these concepts were invented for relatively simple domains, like a group of patients, and are not well-suited to handle the rich structure of modern databases. In modern databases we may have many different types of entities that interact in different ways; for example planes, passengers, pilots, flight attendants, and airports are all related to each other in different ways. Computer models that integrate relationships form the basis of learning programs that make queries possible and predict intelligent mathematical solutions from information profiles. The answers will help human beings perceive and evaluate risks and opportunities in complex situations from healthcare to helicopters.""412057,""Schulte, Patricia"
"406165"	"Schuurmans, Dale"	"Learning structure models from complex data: principles and algorithms"	"Almost all data is now digitally stored, with unprecedented computing power available to process it.  These developments have created new opportunities to advance computer interpretation (e.g. natural language processing, computer perception) and intelligent data-analysis (e.g. bio-informatics) by analyzing the massive amounts of complex data stored in text, multimedia, and scientific repositories.  My research addresses the fundamental challenge of synthesizing predictive models from data, focusing on the problem of learning structured predictors in the presence of latent variables and incomplete observations.  These challenges are motivated by the fact that predictions in complex domains are not just simple class labels or scalar values, but are complex structured outputs---such as parse trees, scene labellings or graph labellings---that involve multiple outputs to be predicted in a coordinated fashion, often with intervening latent variables.  The key problem is training complex predictors when some of the output or intervening latent variables are unobserved.   To tackle these problems, I employ two key strategies.  First, I exploit probability models, which specify optimal interpretations from noisy, incomplete and conflicting evidence.  Thus, one aspect of my research focuses on developing new algorithms for learning and inference in structured probability models.  Second, I formulate convex training principles for the implied learning problems.  Convexity decouples parameter optimization from model quality: a poor result arises from poor model structure, not a poor local minimum.  A further key insight is that supervised training can be extended to unsupervised or semi-supervised training by following a self-supervised approach, where missing data components are treated as auxiliary variables to be optimized (i.e. inferred) simultaneously with parameter optimization.  A natural convex formulation of joint training can then be obtained by working with equivalence relations over missing components.  This approach has led to fundamental advances in unsupervised and semi-supervised training, including state of the art extensions to support vector machines, maximum margin Markov networks, and expectation-maximization.""393221,""Schuurmans, Dale"
"390600"	"Sesay, AbuBakarr"	"Bluetooth-based radio access with asymmetric processing"	"Hospitals are demanding Wireless networks in order to reliably access/transfer information to/from the point-of-care, allowing healthcare professionals to make faster decisions and diagnosis.  In warehouses, homes, office, etc., information, products and documents need to be distributed and tracked. The objective of this project is to develop an asymmetric wireless network experimental system with centralized processing and distributed access points that provide wireless service to picocells (cluster of room, etc.) using Bluetooth devices and sensors. Access points are fitted with multiple antennas (MIMO) and are connected to the processing centre via optical fibers or cables. The access points are generic (non-standard specific) and therefore enables the network to support other standards such as IEEE 802.xx. Signals on the reverse links are down converted, amplified and sampled at the access point, and transmitted to the processing centre where the bulk of the processing is done according to signal format or standard. On the forward link, signalling format such as modulation, error correction coding, space time coding, beamforming, encryption, etc. are generated at the processing centre and transmitted to the access points. Optical fibers or cables provide the wide bandwidth required for data transfer to/from the access point. This asymmetric configuration provides numerous opportunities. The access points need not be replaced as standards evolve. There is more flexibility with respect to processing power requirement, ease of signal format or antenna reconfiguration and security processing.  The test bed is, therefore, useful for multi-standard operation and for testing new standards and algorithms. Novel, low complexity, low power MIMO processing algorithms will be developed to improve transmission rate, co-existence with other wireless systems and user capacity. These solutions will lead to a new design of local/personal area networks and multi-standard access points that will significantly impact, for example, how Canadian healthcare professionals handle and share patient inormation for speedy diagnosis and treatment.  Other Canadian services that will benefit are warehouses, offices, schools etc.""391637,""Seshadri, Rangaswamy"
