"id"	"researcher_name"	"application_title"	"application_summary"
"391262"	"Freundorfer, Alois"	"Towards 3D high speed circuits"	"Information technology and consumer products such as cellphones, computers, video recorders, automotive parts etc. rely heavily on microsystems technology (i.e. microelectronics, photonics, wireless circuits and sensors). Future products will desire systems that are more compact, versatile, functional and less expensive.  Higher operating frequencies and wider bandwidths therefore become necessary. To achieve a higher level of integration, we will focus on 1) high speed electronics using advanced low temperature ceramics and 2) high gain beam-scanning planar antennae.     We have developed a low temperature hydrothermal ceramic process for depositing thin film, thick film and 3-D ceramics onto integrated circuits and printed circuit boards. Most ceramics have to be made at around 1000 degrees or more. This destroys the integrated circuit. We can do it at 150 degrees. No one else has achieved this. This will impact tunable electronics, miniature electronic resonators and filters with the development of appropriate masking methods. We will be the first to integrate 3-D ceramics onto integrated circuits. This will reduce product size and cost. We would also investigate new ceramic materials in our low temperature process.     High gain beam-scanning planar antennae are important in many applications such as automotive radar, satellite communications, room penetrating security/surveillance radars, and non-contact medical diagnostics. We have developed a new high gain antennae which operates at a single frequency whose  beam is steerable. Currently, the beam can only be scanned over a maximum  angle of 14 degrees. Our research aims to increase the scanning angle. Since the antennae is planar, it can be easily fabricated on a printed circuit board and  integrated in a product, thereby reducing costs.     These two areas of research will assist the Canadian industry in producing and manufacturing smaller, more versatile and less expensive products.  This will provide a substantial competitive advantage globally in automotive radar, millimeter wireless LAN and medical diagnostics equipment.""393311,""Frey, Brendan"
"396666"	"Friedlander, Michael"	"Large-scale numerical optimization"	"Optimization problems arise in a wide range of science and engineering disciplines.  The goal is to minimize (or maximize) an objective function while satisfying certain constraints.  Applications often give rise to optimization problems with significant structure that can be exploited to efficiently solve problems with thousands--sometimes millions--of variables.This proposal describes a five-year research program to develop innovative optimization algorithms for solving large-scale problems of practical interest.  I will address issues in algorithm development, analysis, and implementation. The research plan involves the following three main components: development of general-purpose algorithms for nonlinear optimization, development of specialized optimization methods for particular applications, and algorithm implementation.In many applications, optimization is a vital step in a larger procedure; it is therefore critical that optimization algorithms be fast and reliable.  Advances in efficiency and robustness are welcomed by optimization users in industry and academia.  I anticipate that the proposed research will have impact on three groups: researchers in numerical optimization, researchers in specific application fields, and industry practitioners.  The first group will benefit from the extension of current optimization theory and from general algorithm development.  Special-purpose algorithms and the development and release of open-source optimization software will make their impact on the latter two groups.""389709,""Friedman, Alinda"
"402849"	"Fung, Benjamin"	"Privacy-preserving RFID systems for data analysis"	"Radio Frequency IDentification (RFID) is a technology of automatic object identification. A typical RFID system consists of multiple tags and readers, and an infrastructure for handling the high volume of data. The tag is a small device that can be attached to an object, such as a person or a product, for the purpose of unique identification. The reader is an instrument, positioned in a strategic location, that communicates with the RFID tag. It broadcasts a radio signal to the tag, which then transmits its information back to the reader. Streams of RFID data are then stored in a database for analysis. Although RFID would be useful in a broad spectrum of applications, such as supply chain management, e-passports, and patient care and management, the uniquely identifiable tags pose a threat to privacy by tracking a person's movements or profiling an individual. Some privacy advocates have even labeled RFID as the ""worst thing that ever happened to consumer privacy."" Clearly, the privacy concern is an obstacle to the acceptance of RFID technology.     This research program overcomes the privacy obstacle in RFID information systems and develops a series of anonymization methods to transform the underlying RFID data into a version that hides sensitive information, yet keeps it useful for data analysis. RFID data poses new challenges to traditional database, data mining, and privacy-preserving technologies due to its unique characteristics: it is time-dependent, location-dependent, and is generated in large volumes of stream data. Previous works in privacy-preserving RFID technology mainly focused on the hardware and communication protocol layers instead of the database layer, in which a large amount of data actually resides.     The research results will contribute to the core data mining and privacy preservation domains, as well as the industries that employ RFID technology, sensor networks, and location-based services. The proposed research will result in a secure environment for employing RFID technology without sacrificing its information usefulness.""409233,""Fung, Carlen"
"393292"	"Gardner, William"	"Formal model-driven synthesis for concurrent systems"	"Concurrent systems present special design challenges due to their complex interactions, both with their environment, as in the case of reactive real-time systems, and internally in terms of synchronization and communication among their components. Such systems are encountered in diverse contexts -- single computers, distributed systems, or embedded systems with hardware and software components -- and some are safety-critical, that is, failures can endanger human life. Conventional design techniques are unable to insure that these systems will perform as expected when stimulated by inputs, and that they will not deadlock.     Formal methods, which involve writing the specifications for a system's behaviour using a mathematically rigourous notation, have been advocated as a way to verify system properties with the help of model-checking programs. However, industry practitioners have not been eager to adopt abstruse mathematical notations, uncommon programming languages, or additional costly engineering process steps. These approaches are also of limited value when the formal specifications have to be translated by hand into a common programming language, since the verified properties may be lost in the conversion.     This research makes the use of the algebraic formal method known as CSP, or Communicating Sequential Processes, more practical. System specifications written in CSP notation can be verified by means of a commercial model-checking program, then, using our design automation software, automatically translated into C++ and compiled into a running program. Additional components written in C++ can be ""plugged into"" the system's CSP control structure. The designer selectively applies the CSP formalism to critical portions of the system, leaving the non-critical portions to be written in C++, a popular programming language, by programmers without special training. This approach, called CSP++, will make it easier to design and implement reliable concurrent systems. We are extending CSP++ to allow controlling of digital hardware components, and to give the option of formally developing selected software components using B-Method.""402659,""GardnerCosta, Jesse"
"402823"	"Gasevic, Dragan"	"Towards semantic web-enhanced model-driven engineering"	"Today, we need a wider variety of software solutions than ever before. It follows then that we need novel methods that will allow for rapid development of software systems in order to be ready for any future technological challenges. This situation motivated researchers to establish the model-driven engineering (MDE) discipline to achieve three goals: increasing the productivity of software developers by focusing on domain-specific (non-technical) details; reusing the same design for several platforms; and allowing for early discovery of software errors. However, software is a knowledge repository where knowledge is largely related to the application domain, and not to software as an entity itself. So, we need to be able to share (trace, manage, interoperate) the knowledge encoded in software with the knowledge about all relevant aspects surrounding and influencing software (e.g., requirements and policies). With today's critical role of the Web and Web-based software systems, the need to be able to share the knowledge based on which a system is build is even higher. This knowledge sharing and management requires the use of an explicit definition of knowledge, as that is a basic need for machines to be able to interpret knowledge. It is natural then why the Semantic Web technology is a promising way to address these current problems.      This research explores the integration of the Semantic Web technology into software engineering by using MDE, with the final result producing synergetic effects for both technologies. These efforts can be in general classified into three general categories: (i) Integration of Semantic Web languages into the MDE theory; (ii) Model-driven engineering of Semantic Web languages; (iii) Semantic Web-enhanced development of domain-specific languages (for service-oriented architectures and e-learning). The major contribution is the semantic enhancement of the MDE process which should increase its efficiency and effectiveness, and assure that developed systems can precisely integrate the knowledge of domains under study. Moreover, the research should provide tools for developing software systems, leveraging benefits of the Semantic Web.""413753,""Gasevic, Dragan"
"402819"	"GhaderiDehkordi, Majid"	"Cross-layer optimization in wireless data networks"	"Data networks such as the Internet have traditionally been designed in a layered fashion where each layer communicates only with the layers directly above and below it through predefined interfaces. A layered architecture has also been implemented for wireless networks mainly because of inter-operability issues with legacy wireline networks. However, it is well known that such a layered design may not be appropriate for wireless networks due to the specific characteristics of wireless medium, i.e. high error rate and large rate variability, which can negatively impact higher layer network protocols. In particular, it has been suggested that some interactions across different protocol layers can significantly improve the performance of wireless systems.The objective of this research is cross-layer optimization of modern wireless data networks. Specifically, the goal is to improve TCP throughput by exploiting the information available at the protocol layers above and below TCP. The reason for focusing on TCP is that the majority of network traffic in both wireline and wireless networks is carried by TCP, and it is expected that TCP will remain the de facto transport protocol for a wide variety of applications in the future. Therefore, it is important both to understand its behavior, and to improve its performance in emerging wireless systems in order to provide better and more cost-effective wireless data services for end users.To achieve this goal, the following objectives are set for this program:(1) Characterizing TCP performance in modern wireless networks,(2) Developing practical mechanisms to address TCP performance problems in such networks,(3) Implementing the developed mechanisms to assess their performance experimentally.""408542,""Ghadie, Mohamed"
"391755"	"Giesbrecht, Mark"	"Sparsity, complexity and practicality in symbolic mathematical computation"	"This proposal describes a comprehensive program of research into the design, analysis and implementation of algorithms for foundational problems in symbolic mathematical computation.  These are the algorithms that make commercial mathematical software like Maple and Mathematica run.  They allow us to manipulate and solve large and complex sets of equations exactly, even when some quantities are unknown and left as variables.        My research will centre on three specific areas: solving sparse linear equations with exact rational numbers as entries, algorithms for approximate or ""noisy"" polynomials, and computing with ""lacunary"" polynomials (polynomials with high degree but only a few non-zero terms).  The common thread of the described projects is a focus on exploiting sparsity, the existence of lots of zeros or ""holes"".  In other words, if a very large problem we wish to solve has a very succinct description, we want to use this to make our algorithms run more quickly.        As an example, a system of thousands of simultaneous equations, where each equation involves only three variables, should be solvable more quickly than a system where each equation involves thousands of variables.  Our algorithms and software will allow us to treat the enormous and sparse equations that now challenge us in symbolic mathematical computation and its applications.  I will also consider ""approximate"" equations, where some of the data involved may be imprecise or noisy (say from experimental data).  I will show how to reconstruct equations to model such data which are of small size, thus making subsequent operations faster.  Finally, I will explore the exciting theoretical world of ""super sparse"" or lacunary polynomials. Computing with these pushes the limits of algorithmic science, but also may lead to useful methods in practice.        The algorithmic advances will be implemented in the symbolic linear algebra software library LinBox and in the computer algebra system Maple.  Both provide an avenue for broad dissemination of our methods.""400245,""Gieselman, Tanis"
"395372"	"Glaesser, Uwe"	"High level design of distributed embedded and mobile systems"	"My overall research objective is the development of a comprehensive methodological framework for computational and mathematical modeling of complex distributed systems at high levels of abstraction as required for the early software development phases to ensure that the key system attributes are properly established and well understood prior to actually building the system. Focusing on semantic rather than syntactic aspects, the identification and elimination of design flaws and undesirable side effects requires precise models of the expected system behavior and the use of such models for analyzing functional system properties, test case generation, and runtime verification. This research proposal focuses on formal aspects of software technology, industrial applications of formal methods, computational modeling and validation of public safety and security systems and spatiotemporal characteristics of crime patterns. Building on solid theoretical foundations, the emphasis is on applications of knowledge and skills to solve practical problems in a range of diverse application domains. A common challenge in all of the research activities is the need for bridging the gap between formal and empirical approaches. Addressing practical needs requires novel ideas for combining mathematical concepts and formal methods with computational techniques that work in practice. Exploiting the experience from extensive applications of the Abstract State Machine (ASM) method to the specification and validation of distributed and embedded systems, the proposed approach strives for a combination and systematic integration of the ASM modeling paradigm with other paradigms for analysis, modeling, validation, and verification of behavioral aspects of complex concurrent and reactive systems in real-life application contexts.""404993,""Glanfield, Joel"
"392744"	"Grahne, Gosta"	"Multifaceted data management on the web"	"The phenomenal success of database technology is based on the use of high level languages (such as SQL) and on the ability of the query processor to perform optimization tasks, i.e.  to render the query into a form that can be efficiently executed. The state-of-the-art technology works well in the traditional client-server relational or object-oriented setting. However, with the emergence of the {em World Wide Web}, as well as with the proliferation of electronically stored data, the client-server architecture as well as the relational or object-oriented approach are changing. The architecture is moving towards data sourc (databases, file-servers, web-pages, XML-document) interconnected through various mediators, integrators, peer-to-peer connections, and the data model is moving towards semi-structured data and XML. The new environment poses the multifaceted challenges of integrating data from different sources, while mapping schemas and data, reconciliating conflicting data, handling incomplete information and uncertainty, tracing the source of the data, and assigning reliability to it. Although each of these aspects have been studied in isolation before, their interaction poses some hard problems to be solved in order to guarantee semantically correct query answers and efficient query processing.  ""399936,""Grainger, Sue"
"403683"	"Grant, Kevin"	"Developing runtime structures for Bayesian network inference"	"Bayesian networks are a means of exploiting conditional independence information in joint probability distributions to facilitate both a compact representation of a joint distribution, and faster inferences from that distribution, without sacrificing the integrity of the original information.  This is crucial for probabilistic decision-making in settings where variables interact in complex ways, such as medical decision making. It also facilitates and improves the accuracy of classification, forecasting, and fault diagnosis. Any software that improves the efficiency of decision-making, without sacrificing accuracy, makes deployment on consumer hardware more feasible.  One of the major criticisms of using Bayesian networks in application is that their computational demands are often very high, both in terms of runtime and memory.  In our proposed research program, we intend to develop streamlined data structures for computing over Bayesian networks at runtime.  These data structures will be constructed according to application constraints on resources such as time and memory.Finding the optimal runtime structure for a particular set of resource constraints is a problem in combinatorial optimization, with a very large search space.   Evaluating the results of our optimizations will often require an exhaustive search over all possible representations, which is very time and space expensive.  To assist us in this research, we are proposing the purchase of a high-performance computer that will allow us to evaluate our optimization methods as efficiently as possible.  ""402841,""Grant, Kevin"
"394707"	"Guergachi, Aziz"	"Knowledge engineering principles for the effective management of complex systems"	"This research focuses on investigating advanced machine learning techniques with applications to engineering and business management. In the engineering area, we look at the analysis of the risk of failure of drinking water facilities. Contrary to what one may think, waterborne disease outbreaks in developed countries seem to continue to occur on a relatively regular basis. The reason for this phenomenon is not the lack of adequate treatment technologies. Rather it is the cumulative impact of a sequence of small individual events, each of which is relatively harmless on its own, that leads to the outbreak - hence the systemic nature of the causes of the failures, and the relevance of machine learning techniques such as kernels and pattern recognition algorithms (for the classification of a sequence of events as 'collapse-oriented' or 'survival-oriented'). In the business management area, the focus is on the topic of sales forecasting and management, which has a direct connection with the issue of job losses in the manufacturing sector in Ontario. This type of job losses is a direct consequence of the drop in manufacturing sales, which is itself due to the appreciation of the Canadian dollar against the United States dollar. Such an appreciation leads indeed to the odd situation where Canadian products suddenly become more expensive for American customers, while the value-adding features of these very same products have not changed at all - hence the drop in sales. Laying-off workers has so far been the quickest way, for manufacturers, to react to this drop in sales. There is, however, no evidence that the laying-off of workers is the optimal control action (in the control-theoretic sense of the term) to react to currency appreciation. The applicant and his co-workers developed a quantified system to help salespeople and managers analyze their interactions with customers, develop sales forecasts and design adequate action plans for the future. In this project, we intend to investigate both of these applications using the state-of-the-art techniques for machine learning, knowledge representation and pattern analysis.""399471,""Guérin, Brigitte"
"393608"	"Gulliver, Aaron"	"Wireless multimedia communications"	"People throughout the world are inherently and fundamentally mobile, they expect to be connected wherever they are. It is therefore not surprising that the wired world is rapidly becoming wireless. In addition, wired technology has advanced to the point where people expect very high speed, reliable real-time services in the home and elsewhere. It is natural that mobile users demand similar service levels. With this wireless revolution come many challenges to providing a positive user experience. Future wireless communications systems must be based on low cost, intelligent portable devices that can operate in a variety of hostile environments. The objectives of this research program are to develop innovative techniques for robust, low complexity, wireless multimedia communications systems. The goal is to produce future systems which can deliver high data rates; be efficient in both power and bandwidth; provide access anytime over a wide service area with multiple levels of reliable quality of service (QoS); and deliver diversified services with ease of use.This research program will focus on several key enabling technologies which will accelerate the achievement of the above goals. Orthogonal Frequency Division Multiplexing (OFDM) and Ultra-WideBand (UWB) will be considered. These modulation techniques will dominate future wireless systems due to their flexibility, simplicity and robustness to fading. Optical wireless is a very promising high bandwidth, low interference alternative to RF communications. Future system must adapt to their environments, therefore low complexity adaptive techniques will be considered within the framework of resource management, cross-layer design and QoS. To achieve the goal of a consistent user experience, applications will have to be more efficient, and more intelligent. Networks that can adapt to the wireless environment are essential.  Thus this project will consider the design of systems that can dynamically adjust resources according to channel and traffic conditions. One major application for this work is the delivery of IPTV/Video on Demand (VOD), voice and data to the home, the so-called triple-play of services.""413464,""Gulliver, Aaron"
