"id"	"researcher_name"	"application_title"	"application_summary"
"396802"	"Magen, Avner"	"Geometrical approaches to approximation algorithms: new avenues and analytical limitations"	"Computers rely on algorithms, pre-definied sets of rules, to solve problems. But some problems are simply too difficult and do not allow for an exact solution in a reasonable amount of time even when the input size is modest. In such cases researchers have resorted to ""approximation algorithms"" that work in reasonable amount of time and yet do not compromise too much in the accuracy of their solutions. As the field of approximation algorithms matured, the algorithms that were being designed tended to fall into one of a relatively small number of algorithmic-paradigms.My particular research focuses on some of these approaches, mainly ones that are based on geometric considerations. The first is the ""semidefinte relaxations"" approach, in which we look at a problem with relaxed conditions that is solvable, and the challenge is to relate it with the original one. This technique was shown to be very powerful and has gained much popularity in the last decade. In addition, I study the area of ""metric embedding"" where geometric simplifications are sought in order to transform a hard problem to a simpler one using distances as important parameters.I am also interested in showing limitations these and other algorithmic paradigms, such as dynamic programming, greedy algorithms and backtracking algorithms have. Such insights may indicate new ways of finding algorithmic methods that overcome the obstacles the existing ones suffer from. Last, I am interested in finding sublinear-time algorithms to problems where the typical input size is too large even to be read completely. ""400829,""Magesan, Easwar"
"390660"	"Majumdar, Shikharesh"	"High performance distributed systems: resource management and middleware"	"The availability of computing systems and communication networks at a reasonable cost is rapidly increasing the deployment of parallel and distributed systems. A grid that provides on-demand access to computing, storage, communication and various other types of resources that include wireless devices and sensors is receiving a great deal of attention in various fields including scientific, engineering as well as enterprise computing. Achieving a desired level of quality of service, scalability, high resource utilization and robustness are important for an effective deployment of such systems. Effective management of resources is crucial in achieving these system objectives. With the rapid evolution in both hardware and software technologies inter-operability on a heterogeneous environment is becoming an important requirement for distributed applications that utilize the system resources described earlier. Middleware is the glue that provides such inter-operability.  Due to the multi-billion dollar investment in Web Services (WS) technologies by major software companies, many inter-operable systems of the future are expected to be WS-based. Although WS-based systems can provide inter-operability, if not designed carefully, the concomitant system overhead can give rise to severe performance penalties. Research is proposed for resource management on grids as well as on high performance WS-based systems. The research results will be useful in application design, operating systems, and middleware for grids and other web services-based parallel/distributed systems.The applicant is involved in research on resource management and middleware for distributed systems for a number of years and his work includes pioneering research on parallel job scheduling. His activity in the past six years is reflected in 10 journal papers, 3 contributions to books, a number of refereed conference papers and invited contributions, chairing conference and program committees, and selection as a Distinguished Visitor for the IEEE Computer Society. The applicant's experience, as well as the high caliber graduate students and the facilities available at Carleton University will be useful in achieving the project objectives.""405410,""Mak, Anthony"
"399361"	"Mandryk, Regan"	"Sensing and adapting to user context in human-computer interaction"	"Despite progress in graphics capabilities and processing power, current interactive applications still have considerable usability problems. One main reason for these problems is that applications do not understand or adapt to users' context, such as their location, situation, expertise, or emotional state. As a result, applications often act inappropriately: they provide inappropriate feedback, interrupt the user at the wrong time, increase frustration, and overwhelm the user with unsuitable information. In order to solve these problems, we must make significant advances in two key areas: first, a set of mechanisms for gathering, interpreting, and modeling user context; and second, a set of techniques and strategies for adapting user interfaces and system behaviour based on contextual information. My research program investigates three main themes in sensing user context and adapting user interfaces. The first theme will focus on the detection and modeling of user emotional state when engaged with interactive technologies. The second theme will focus on the detection of user expertise and the provision of intelligent help based on this information. The final theme will focus on the detection of cognitive interruptibility, and the subsequent treatment of interrupting notifications in computer interfaces. Contributions will be made in the areas of user modeling, interface design, intelligent and adaptive interfaces, affective computing, and context-awareness. ""403756,""Mandryk, Regan"
"395714"	"Mao, Zhiwei"	"Next generation wireless communications:  cognitive radio and wireless sensor network"	"The proposed research will investigate different aspects of next generation wireless communications. We propose to investigate cognitive radio technique, which is a new spectrum management framework where unlicensed secondary radio devices are capable of sensing spectrum utilization and effectively adjusting their transmission parameters in order to utilize the large amount of unused spectrum in an intelligent way while not interfering with licensed primary users. We propose to investigate intelligent opportunistic spectrum access in a cognitive radio framework, to develop efficient transceiver designs and error control coding schemes and to develop theoretical analyses of the performance in cognitive spectrum sharing systems. In addition, we also propose to investigate the spatial sampling design in wireless sensor network. The scientific approach will be based on literature survey, analytical modeling and extensive computer simulations. Implementation complexities will also be examined.The importance of the proposed research lies in the demand for the tremendous market for different low-cost high-speed wireless services and applications, and the need to produce skilled graduates to exploit the state-of-art technologies for our economic benefits.""409907,""Mapiour, Majak"
"389587"	"Mark, Jon"	"Wireless communication networks:  network interworking, and resource, mobility and traffic management"	"The proposed research will investigate into resource, mobility and traffic management issues in hybrid wireless/wireline networks (e.g., wireless LANs, cellular and Internet) and interworked wireless mesh networks such as WiFi (IEEE 802.11 series) and WiMAX (IEEE 802.16 series).  The long term objective is to develop in-depth knowledge towards the construction of a flexible and robust cross-domain internetworking architecutre, i.e., an information transport platform, for handling multimedia services in fixed and mobile environments.  The short term objectives are to (i) investigate cooperative diversity with partial channel state information, to be acquired via channel estimation, (ii) investigate dynamic spectral access in cognitive radio, (iii) investigate cross-layer design and optimization for interworked wireless mesh networks, and (iv) develop modeling and analysis methods for wireless Internet.  The results from the short term objectives will form the building blocks toward fulfillment of the long term objective.Communication over wireless interconnected networks has a number of challenging issues, chief among which is the bottleneck created by the wireless propagation channel, the dynamics induced by user mobility.  The research program laid out by the above four objectives addresses very challenging issues, each of which embodies a rich paradigm for contributions of new knowledge, novel signaling techniques, enabling networking technology, etc., and a rich environment for the training of highly qualified personnel.  Protocol design making efficient use of elements and traffic profiles across adjacent layers can lead to flexibility and robustness.  A flexible and robust information transport platform that allows for information transmission from anywhere at anytime with user QoS satisfaction will indeed have a great impact on the social and economic welfare of Canada.""400611,""Market, Brenna"
"392008"	"Massicotte, Daniel"	"Métaheuristiques pour le traitement des signaux à précision finie en communication"	"Le projet vise la proposition de métaheuristiques pour l'annulation des interférences dans les systèmes de communications mobiles offrant le meilleur compromis performance/complexité pour une mise en oeuvre efficiente en arithmétique entière. L'un des problèmes majeurs et communs à tous les systèmes de communications est la présence d'interférences multiples qui nuisent à la qualité des communications. Dans la littérature, plusieurs propositions apportent des solutions théoriques performantes pour reconstituer les informations dégradées, mais peu tiennent compte d'un développement conjoint de l'algorithme et de son architecture en vue d'une intégration sur silicium. En fait, la complexité et le type de structure algorithmique des solutions développées pour ces applications rendent peu efficace leur mise en oeuvre physique en raison des contraintes de temps de calcul, d'exactitude, de consommation de puissance, de coût... La méthodologie proposée consiste à voir le calcul des paramètres du filtre comme un problème d'optimisation difficile plutôt qu'un problème de minimisation d'une fonction de coût comme la descente du gradient. L'originalité du projet réside dans la proposition de métaheuristiques pour l'estimation des informations désirées dans un système dynamique linéaire ou nonlinéaire, optimisant le fonctionnement en arithmétique entière pour un compromis performance/complexité adapté à la technologie de mise en oeuvre cible. L'idée est de pouvoir poser des fonctions multi-objectives capables d'être résolues par des métaheuristiques. De ce fait, en basant le calcul des paramètres, des coefficients et de la structure du filtre sur une métaheuristique discrète, le calcul à précision finie devient intrinsèque à l'algorithme et permet d'optimiser l'adéquation algorithme-architecture selon une fonction multi-objective. Pour valider l'approche, nous proposerons des solutions aux systèmes de communication mobile CDMA, OFDM, MIMO, et Beamforming. À long terme, cette approche mènera au développement de solutions optimales en termes d'adéquation algorithme-architecture pour le traitement numérique des signaux.""391001,""Massicotte, Guy"
"406154"	"McCann, Robert"	"Optimal transportation: geometry and dynamics"	"This proposal focuses on the analysis of a family of optimization and evolution problems having applications in physics, geometry, medical imaging, partial differential equations, and economics.  Linking them together is a transportation problem --- which comes into play whenever the dynamics conserve a local quantity.  It can be caricatured as follows: Given a distribution of iron mines throughout the countryside,  and a distribution of factories which require iron ore,  decide which mines should supply ore to each factory in order to minimize the total transportation costs.  Here the cost per ton of ore transported from the mine at x to factory at y is specified by a function c(x,y).  However, when the mines and factories are distributed continuously over a curved landscape, then the problem has a rich structure and deep connections to geometry, nonlinear partial differential equations and the topology of the cost function, which have only begun to be explored.Incarnations of this problem embed in current models of surprisingly diverse phenomena. Included among the subjects of proposed research are questions related to atmospheric weather patterns, groundwater drainage,  pollutant diffusion, population spreading, and economic decision problems facing informational asymmetry.In addition to these applications (and motivated by them),  this proposal includes a continuing investigation of the structure of solutions --- maps or otherwise --- to the transportation problem in a variety of geometric settings.  Despite much recent progress,  basic questions still remains:  classify all costs for which solutions are unique;  understand when production location will vary smoothly with consumption,  and,  if this is not the case, identify the nature and location of discontinuities.  Although the research is directed primarily at gaining scientific understanding, it has potential applications for resource management, engineering design, weather prediction, improved microeconomic and policy decisions, and logistics.""393066,""McCann, Robert"
"393189"	"McInerney, Timothy"	"Interactive visual analysis of multidimensional medical data"	"The goals of the research are to explore and develop novel software tools, techniques and systems to allow simple, intuitive, efficient, interactive visual exploration, measurement, and analysis of medical data sets, useable by both radiologist and surgeons. The focus will be on tools for 3D and 4D (i.e. time series) medical data, including newer image modalities such as 3D ultrasound. Specifically, tools and techniques will be developed for object extraction and modeling, visual comparison of two objects, object feature emphasis, object manipulation in 3D, object measurement and annotation, tracking changes in objects, object interrelationship analysis, volume image navigation, and sharing and recording of multimedia diagnostic reports and surgical plans. The integration of user collaboration mechanisms is also a major focus, allowing multiple users to view and interact with the image data or with diagnostic reports.""397762,""McIntire, Eliot"
"402629"	"Mi, Zetian"	"Antimony-based self-organized quantum dots:  epitaxial growth, characterization, and photonics at the nanoscale"	"The driving forces for future technologies have increasingly relied on the exploration of novel nanoscale materials. Antimony (Sb)-based self-organized semiconductor nanostructures, such as InAs(Sb)/InGaAsSb and InSb(As)/InAs quantum dots and nanowires, a class of novel materials with tremendous importance for infrared and terahertz photonics, have remained largely unexplored. In this program, the PI will investigate the growth and fundamental characteristics of such nanostructures and develop near-, mid-, and far-infrared nanophotonic devices, providing enabling solutions for critical technologies in communications, spectroscopic sensing, medical imaging and future quantum computing. In the short-term, the PI will develop 1.55 µm InAs(Sb)/InGaAsSb quantum dot lasers and amplifiers on GaAs that can significantly outperform their quantum well counterparts, for applications in fiber optical communications. In the medium-term, the PI will investigate the epitaxial growth and characterization of Sb-based mid-infrared quantum dot heterostructures and extend, for the first time, the demonstrated InAs quantum dot technology developed by the PI and other researchers, to the mid- and far-infrared frequency ranges. The third focus is the development of novel quantum dot and nanowire heterostructures with precisely controlled properties by utilizing the novel technique of selective area growth on nano-patterned substrates, with the long-term goal is to realize electrically-injected ultrahigh-speed nanoscale lasers and high-efficiency single photon sources, fundamental building blocks for future quantum computing and information processing systems. The proposed research program extends across several frontiers of science and engineering and will provide an exceptional opportunity for students to acquire knowledge and gain expertise in epitaxial growth, nanofabrication, and characterization of nanophotonic devices and, therefore, prepare them well for future careers in emerging areas of nanoscience and nanotechnology.""393740,""Miadonye, Adango"
"395521"	"Michelson, David"	"Propagation and channel modelling for wireless communications"	"As wireless communications moves to higher frequencies, new environments, and more demanding applications, and as end user expectations for performance and reliability increase, it has become increasingly necessary to either develop new propagation models and/or re-estimate the parameters of existing ones so that appropriate techniques for mitigating the effects of fading, delay spread, and time variation can be devised.We propose to develop and apply the instrumentation, tools and techniques required to characterize the propagation channel in three environments of extreme interest to wireless system developers: (1) fixed and pedestrian channels in urban and suburban macrocell environments, (2) fixed and pedestrian channels in industrial and health care microcell environments and (3) Ka-band links from earth to satellites in low earth orbit. The propagation and channel models that we develop will capture our knowledge and understanding of airlink impairments in a form useful in design, simulation and test. As such, they will play important roles in the software and hardware simulators and RF planning tools used at all stages of the product development life cycle, from system engineering to implementation to manufacturing to deployment. The results will broadly benefit the Canadian wireless industry, including manufacturers, consultants, operators and end users.""388591,""Michener, Gail"
"394411"	"Miri, Ali"	"Secure distributed information systems"	"Advancements in computer and communication technologies are rapidly changing how users and computers interact with each others. In this new computing paradigm,  information can be gathered from a network of tiny sensors, processed by portable and wireless devices with various communication capabilities, and stored across distributed databases.  Privacy and security represent a major challenge in such  distributed information systems. This proposal describes our plan to design better and more efficient sensor and Radio Frequency IDentification (RFID) networks, where information is transmitted between the nodes in a secure fashion, and intruder and malicious activities are easily identified. We will design new light-weight cryptographic tools ideal for use in resource-constrained devices, and build algorithms which allow sharing information across different databases while ensuring the privacies of parties involved.""393018,""Miron, Gilles"
"402851"	"Modersitzki, Jan"	"Constrained imaged registration"	"Image registration is a commonly used technique to align images or data acquired from different positions at different times or with different devices. The objective of image registration in a clinical environment is to align these views in order to produce a meaningful diagnosis or treatment planning. For example, the diagnosis and treatment of female breast cancer may require a time series of three-dimensional magnetic resonance images (MRI), visualizing the contrast uptake in the tissue. This uptake, divided into the so-called wash-in and wash-out phases, is of particular interest, since it characterizes tissue properties. Assuming the female breast to be static, a point based analysis would provide the uptake characteristics as a function in time. However, the acquisition time is usually around ten minutes and due to motion of the patient, like heart beat or breathing, the breast is not static and the interpretation of the data is weakened and complicated by motion artifacts.Registration techniques are used to automatically compensate for image differences that are related to motion. However, common schemes do not prevent a change of volume of the processed data. This is very delicate, if tumor growth is under consideration. For these applications, only a volume preserving scheme guaranties that changes of volume is due to measurement and not to the alignment. Unfortunately, there are only two approaches to deal with volume preservation. The first one is suggested by Torsten Rohlfing et al and uses a spline based parametric transformation and penalty based on the integral over volume changes. This approach has some disadvantages. An alternative approach has been suggested by Eldad Haber and myself and is based on a more general non-parametric transformation and explicit constraints on a voxel basis. The essential advantage of the our approach is that it guarantees volume preservation, as has already been shown. However, this approach is computationally quite demanding and since a rigorous implementation is still missing, it can only handle low-resolution data. More research is needed to make this method clinically available.""395670,""Modesto, Sean"
"402630"	"Moez, Kambiz"	"Development of millimeter-wave CMOS transceivers for gigabit wireless personal area networks"	"The unlicensed 60-GHz band offers a large seven-gigahertz bandwidth and great interoperability around the world for development of high-data-rate short-range wireless communication systems. However, there are two major obstacles in the way to widespread use of 60 GHz links. First, as these systems have traditionally been implemented in expensive compound semiconductor processes, the high cost of fabrication has prevented the 60 GHz links from being an economical alternative to low-GHz wireless systems. Second problem is the high absorption of material, especially oxygen, at millimeter-wave frequencies, leading to high path loss and making the transmission of 60 GHz signals very difficult. To address these problems, we define our research proposal as the design and implementation of fully-integrated low-cost millimeter transceivers in a nanometer CMOS technology. Very recently, aggressive CMOS scaling into the nanometer regime has produced transistors with cutoff frequencies well over 100 GHz, enabling the CMOS technology to be used for implementation of 60-GHz transceivers. The full integration of mm-wave transceivers minimizes the fabrication cost by reducing the dimension of a 60-GHz wireless radio to a few square millimeters as well as eliminating the cost of packaging. Therefore, 60 GHz transceivers can be implemented at the lowest possible cost in CMOS technology.  On the other hand, as CMOS offers highest level of integration of all semiconductor technologies, several transceivers and antennas can be integrated on a single CMOS chip. A multiple-input-multiple-output scheme complemented by a smart antenna array structure can effectively compensate for the path loss of material, making the detection of 60 GHz signal easier than for a single-transceiver single-antenna system. However, there are several challenges  in the design of circuits at frequencies very close to limitation of the technology and implementation of high quality passive devices on lossy silicon substrate. These challenges will be tackled in this research project through discovery of new modeling methods, innovative circuit techniques, and efficient system architectures.""388309,""Moffat, Anthony(Tony)"
"406156"	"Mohar, Bojan"	"Topological and algebraic graph theory"	"This research involves study of interconnections between graphs, topology, and geometry, graph minors, colorings and nowhere-zero flows, and development of algorithmic and computational tools in these areas. The research program is very broad with a wide selection of open problems and conjectures in the following areas: structural and geometric theory of embedded graphs, algorithms and obstructions for graph embeddings, crossing numbers, graph minors, conjectures of Negami and Barnette, circular colorings and flows, and eigenvalues of graphs. As diverse as these problems are, they have much in common, and this research is aimed at finding new links between them, leading to solutions of open problems.""396585,""Mohar, Bojan"
"406157"	"Mori, Gregory"	"Recognizing human figures and actions"	"In this proposal we describe approaches to tackle the problem of humanactivity recognition.  The grand goal in this area of computer visionis to build systems that can automatically find human figures ineither still frames or video sequences, and determine what action theyare performing.  The recognition of human figures and actions is animportant problem, due to its many practical applications.  Thistechnology is directly applicable to human-computer interaction, imageand video retrieval and search, security and surveillance, videomotion capture, and automated vehicle driver assistance systems.""396736,""Mori, Gregory"
